{
  "type": "AGENT_REVOKE",
  "version": "0.1",
  "from": "npub1ds7azg0huz4lh84a7r49vhehmhkvsfgjds7azg0huz4lh84a7r49vhehmh",
  "to": "npub12qrswl7u4t7qkm2rf8p5r6sfydexy6ea2qrswl7u4t7qkm2rf8p5r6sfyd",
  "timestamp": 1712800200,
  "nonce": "revoke-001",
  "payload": {
    "intent": "connection.terminate",
    "scope": "all",
    "reason": "Owner revoked this agent connection",
    "context": {
      "initiated_by": "owner"
    }
  },
  "signature": "aaaaaaaaaaaaaaaaaaaaaaaaaaaaaaaaaaaaaaaaaaaaaaaaaaaaaaaaaaaaaaaaaaaaaaaaaaaaaaaaaaaaaaaaaaaaaaaaaaaaaaaaaaaaaaaaaaaaaaaaaaaaaaaa"
}
